{
  "$schema": "https://vinyaas.vercel.app/schema/registry-item.json",
  "name": "radio-group",
  "type": "registry:ui",
  "dependencies": ["clsx", "tailwind-merge"],
  "files": [
    {
      "path": "ui/radio-group/index.tsx",
      "content": "\"use client\";\n\nimport React, { createContext, useContext, useId } from \"react\";\n\nimport { cn } from \"@/lib/utils\";\n\ntype RadioGroupContextValue = {\n  name: string;\n  value?: string;\n  defaultValue?: string;\n  disabled?: boolean;\n  required?: boolean;\n  onValueChange?: (value: string) => void;\n};\n\nconst RadioGroupContext = createContext<RadioGroupContextValue | null>(null);\n\nexport type RadioGroupProps = Omit<\n  React.ComponentProps<\"div\">,\n  \"defaultValue\" | \"onChange\"\n> & {\n  name?: string;\n  value?: string;\n  defaultValue?: string;\n  disabled?: boolean;\n  required?: boolean;\n  onValueChange?: (value: string) => void;\n};\n\nexport function RadioGroup({\n  className,\n  name,\n  value,\n  defaultValue,\n  disabled,\n  required,\n  onValueChange,\n  ref,\n  ...props\n}: RadioGroupProps) {\n  const generatedName = useId();\n\n  return (\n    <RadioGroupContext.Provider\n      value={{\n        name: name ?? generatedName,\n        value,\n        defaultValue,\n        disabled,\n        required,\n        onValueChange,\n      }}\n    >\n      <div\n        {...props}\n        role=\"radiogroup\"\n        {...(disabled ? { \"aria-disabled\": true } : {})}\n        {...(required ? { \"aria-required\": true } : {})}\n        ref={ref}\n        className={cn(\"grid gap-2\", className)}\n      />\n    </RadioGroupContext.Provider>\n  );\n}\n\nexport type RadioGroupItemProps = Omit<\n  React.ComponentProps<\"input\">,\n  \"type\"\n> & {\n  value: string;\n};\n\nexport function RadioGroupItem({\n  className,\n  value,\n  disabled,\n  required,\n  name,\n  checked,\n  defaultChecked,\n  onChange,\n  ref,\n  ...props\n}: RadioGroupItemProps) {\n  const group = useContext(RadioGroupContext);\n  const groupControlled = group?.value !== undefined;\n  const checkedProps = groupControlled\n    ? { checked: group.value === value }\n    : checked !== undefined\n      ? { checked }\n      : {\n          defaultChecked:\n            defaultChecked ??\n            (group?.defaultValue !== undefined\n              ? group.defaultValue === value\n              : undefined),\n        };\n\n  return (\n    <span\n      className={cn(\n        \"relative inline-flex size-4 shrink-0 items-center justify-center\",\n        className,\n      )}\n    >\n      <input\n        {...props}\n        {...checkedProps}\n        type=\"radio\"\n        ref={ref}\n        name={name ?? group?.name}\n        value={value}\n        disabled={disabled || group?.disabled}\n        required={required ?? group?.required}\n        className=\"peer absolute inset-0 z-20 size-4 cursor-pointer opacity-0 disabled:cursor-not-allowed\"\n        onChange={(event) => {\n          onChange?.(event);\n\n          if (event.currentTarget.checked) {\n            group?.onValueChange?.(value);\n          }\n        }}\n      />\n      <span\n        aria-hidden=\"true\"\n        className=\"border-input bg-background peer-checked:border-primary peer-focus-visible:ring-ring peer-focus-visible:ring-offset-background pointer-events-none absolute inset-0 rounded-full border peer-focus-visible:ring-2 peer-focus-visible:ring-offset-2 peer-disabled:opacity-50\"\n      />\n      <span\n        aria-hidden=\"true\"\n        data-slot=\"radio-indicator\"\n        className=\"bg-primary pointer-events-none absolute top-1/2 left-1/2 z-10 size-1.5 -translate-x-1/2 -translate-y-1/2 rounded-full opacity-0 peer-checked:opacity-100\"\n      />\n    </span>\n  );\n}\n",
      "type": "registry:ui"
    }
  ]
}
