{
  "$schema": "https://vinyaas.vercel.app/schema/registry-item.json",
  "name": "toast",
  "type": "registry:ui",
  "dependencies": ["clsx", "tailwind-merge"],
  "files": [
    {
      "path": "ui/toast/index.tsx",
      "content": "\"use client\";\n\nimport React, { useEffect, useState } from \"react\";\nimport { createPortal } from \"react-dom\";\n\nimport { cn } from \"@/lib/utils\";\n\nimport \"./toast.css\";\n\nexport type ToastType =\n  \"default\" | \"success\" | \"info\" | \"warning\" | \"error\" | \"loading\";\n\nexport type ToastPosition =\n  | \"top-left\"\n  | \"top-center\"\n  | \"top-right\"\n  | \"bottom-left\"\n  | \"bottom-center\"\n  | \"bottom-right\";\n\nexport type ToastAction = {\n  children: React.ReactNode;\n  onClick: () => void;\n};\n\nexport type ToastInput = {\n  title: string;\n  description?: string;\n  type?: ToastType;\n  duration?: number;\n  actionProps?: ToastAction;\n};\n\ntype ToastRecord = ToastInput & {\n  id: string;\n  type: ToastType;\n  exiting?: boolean;\n};\n\ntype ToastListener = (toasts: readonly ToastRecord[]) => void;\n\nconst listeners = new Set<ToastListener>();\nconst timers = new Map<string, ReturnType<typeof setTimeout>>();\nconst exits = new Map<string, ReturnType<typeof setTimeout>>();\nconst exitDuration = 160;\nlet records: ToastRecord[] = [];\nlet nextId = 0;\n\nfunction emit() {\n  for (const listener of listeners) {\n    listener(records);\n  }\n}\n\nfunction clearTimer(id: string) {\n  const timer = timers.get(id);\n\n  if (timer) {\n    clearTimeout(timer);\n    timers.delete(id);\n  }\n}\n\nfunction schedule(id: string) {\n  clearTimer(id);\n  const item = records.find((entry) => entry.id === id);\n\n  if (!item || item.type === \"loading\") {\n    return;\n  }\n\n  const duration = item.duration ?? 5000;\n\n  if (!Number.isFinite(duration)) {\n    return;\n  }\n\n  timers.set(\n    id,\n    setTimeout(() => {\n      dismiss(id);\n    }, duration),\n  );\n}\n\nfunction removeNow(id?: string) {\n  if (!id) {\n    for (const entry of records) {\n      clearTimer(entry.id);\n    }\n\n    for (const timer of exits.values()) {\n      clearTimeout(timer);\n    }\n\n    exits.clear();\n    records = [];\n    emit();\n    return;\n  }\n\n  clearTimer(id);\n  const exit = exits.get(id);\n\n  if (exit) {\n    clearTimeout(exit);\n    exits.delete(id);\n  }\n\n  records = records.filter((entry) => entry.id !== id);\n  emit();\n}\n\nfunction dismiss(id?: string) {\n  if (!id) {\n    removeNow();\n    return;\n  }\n\n  const item = records.find((entry) => entry.id === id);\n\n  if (!item || item.exiting) {\n    return;\n  }\n\n  clearTimer(id);\n  records = records.map((entry) =>\n    entry.id === id ? { ...entry, exiting: true } : entry,\n  );\n  emit();\n  exits.set(\n    id,\n    setTimeout(() => {\n      exits.delete(id);\n      removeNow(id);\n    }, exitDuration),\n  );\n}\n\nfunction update(id: string, patch: ToastInput) {\n  records = records.map((entry) =>\n    entry.id === id\n      ? {\n          ...entry,\n          ...patch,\n          type: patch.type ?? entry.type,\n        }\n      : entry,\n  );\n  emit();\n  schedule(id);\n}\n\nfunction subscribe(listener: ToastListener) {\n  listeners.add(listener);\n\n  return () => {\n    listeners.delete(listener);\n  };\n}\n\nfunction pause(id: string) {\n  clearTimer(id);\n}\n\nfunction resume(id: string) {\n  schedule(id);\n}\n\nfunction ToastIcon({ type }: { type: ToastType }) {\n  return (\n    <svg\n      viewBox=\"0 0 16 16\"\n      aria-hidden=\"true\"\n      className={cn(\n        \"mt-0.5 size-4 shrink-0\",\n        type === \"loading\" && \"animate-spin motion-reduce:animate-none\",\n      )}\n      fill=\"none\"\n      stroke=\"currentColor\"\n      strokeWidth=\"1.5\"\n    >\n      {type === \"success\" ? <path d=\"M3 8.5 6.2 12 13 4\" /> : null}\n      {type === \"error\" ? (\n        <path d=\"M5 5l6 6M11 5l-6 6M8 1.5a6.5 6.5 0 1 0 0 13 6.5 6.5 0 0 0 0-13Z\" />\n      ) : null}\n      {type === \"warning\" ? (\n        <path d=\"M8 2.5 14.5 13.5h-13L8 2.5ZM8 7v3M8 12h.01\" />\n      ) : null}\n      {type === \"info\" ? (\n        <path d=\"M8 1.5a6.5 6.5 0 1 0 0 13 6.5 6.5 0 0 0 0-13ZM8 7.2V11M8 5h.01\" />\n      ) : null}\n      {type === \"loading\" ? (\n        <path d=\"M8 2.5a5.5 5.5 0 1 1-4.8 2.8\" strokeLinecap=\"round\" />\n      ) : null}\n      {type === \"default\" ? (\n        <circle cx=\"8\" cy=\"8\" r=\"3\" fill=\"currentColor\" />\n      ) : null}\n    </svg>\n  );\n}\n\nexport const toast = {\n  add(input: ToastInput) {\n    const id = `toast-${nextId++}`;\n    const record: ToastRecord = {\n      ...input,\n      id,\n      type: input.type ?? \"default\",\n    };\n\n    records = [...records, record];\n    emit();\n    schedule(id);\n    return id;\n  },\n  dismiss,\n  update,\n  promise<T>(\n    promise: Promise<T>,\n    messages: {\n      loading: ToastInput;\n      success: ToastInput;\n      error: ToastInput;\n    },\n  ) {\n    const id = toast.add({ ...messages.loading, type: \"loading\" });\n\n    promise.then(\n      () => {\n        update(id, { ...messages.success, type: \"success\" });\n      },\n      () => {\n        update(id, { ...messages.error, type: \"error\" });\n      },\n    );\n\n    return id;\n  },\n};\n\nconst positionClass: Record<ToastPosition, string> = {\n  \"top-left\": \"top-4 left-4 items-start\",\n  \"top-center\": \"top-4 left-1/2 -translate-x-1/2 items-center\",\n  \"top-right\": \"top-4 right-4 items-end\",\n  \"bottom-left\": \"bottom-4 left-4 items-start\",\n  \"bottom-center\": \"bottom-4 left-1/2 -translate-x-1/2 items-center\",\n  \"bottom-right\": \"bottom-4 right-4 items-end\",\n};\n\nconst typeClass: Record<ToastType, string> = {\n  default: \"border-border bg-background text-foreground\",\n  success: \"border-foreground bg-foreground text-background\",\n  info: \"border-border bg-muted text-foreground\",\n  warning: \"border-foreground bg-background text-foreground\",\n  error: \"border-destructive bg-destructive text-destructive-foreground\",\n  loading: \"border-border bg-background text-foreground\",\n};\n\nexport function Toaster({\n  position = \"bottom-right\",\n}: {\n  position?: ToastPosition;\n}) {\n  const [items, setItems] = useState<readonly ToastRecord[]>([]);\n  // Start false so the server render and the first client render both omit the portal.\n  const [mounted, setMounted] = useState(false);\n\n  useEffect(() => {\n    const timeout = setTimeout(() => setMounted(true), 0);\n    const unsubscribe = subscribe(setItems);\n\n    return () => {\n      clearTimeout(timeout);\n      unsubscribe();\n    };\n  }, []);\n\n  if (!mounted) {\n    return null;\n  }\n\n  const fromTop = position.startsWith(\"top\");\n\n  return createPortal(\n    <div\n      data-toaster=\"\"\n      data-position={position}\n      className={cn(\n        \"pointer-events-none fixed z-50 flex w-80 max-w-[calc(100vw-2rem)] gap-2\",\n        fromTop ? \"flex-col\" : \"flex-col-reverse\",\n        positionClass[position],\n      )}\n    >\n      {items.map((item) => (\n        <div\n          key={item.id}\n          role={item.type === \"error\" ? \"alert\" : \"status\"}\n          data-type={item.type}\n          data-exiting={item.exiting ? \"true\" : undefined}\n          aria-busy={item.type === \"loading\" ? true : undefined}\n          className={cn(\n            \"pointer-events-auto flex w-full items-start gap-3 rounded-md border px-3 py-3 text-sm\",\n            item.exiting ? \"vinyaas-toast-out\" : \"vinyaas-toast-in\",\n            typeClass[item.type],\n          )}\n          onMouseEnter={() => pause(item.id)}\n          onMouseLeave={() => resume(item.id)}\n          onKeyDown={(event) => {\n            if (event.key === \"Escape\") {\n              event.stopPropagation();\n              dismiss(item.id);\n            }\n          }}\n        >\n          <ToastIcon type={item.type} />\n          <div className=\"grid min-w-0 flex-1 gap-1\">\n            <div className=\"flex items-start justify-between gap-3\">\n              <p className=\"font-medium\">{item.title}</p>\n              <button\n                type=\"button\"\n                aria-label=\"Dismiss\"\n                className=\"focus-visible:ring-ring focus-visible:ring-offset-background cursor-pointer rounded-md px-1 focus-visible:ring-2 focus-visible:ring-offset-2 focus-visible:outline-none\"\n                onClick={() => dismiss(item.id)}\n              >\n                ×\n              </button>\n            </div>\n            {item.description ? <p>{item.description}</p> : null}\n            {item.actionProps ? (\n              <button\n                type=\"button\"\n                className=\"border-border bg-background text-foreground hover:bg-accent focus-visible:ring-ring focus-visible:ring-offset-background mt-1 inline-flex h-7 w-fit cursor-pointer items-center rounded-md border px-2 text-xs font-medium focus-visible:ring-2 focus-visible:ring-offset-2 focus-visible:outline-none\"\n                onClick={item.actionProps.onClick}\n              >\n                {item.actionProps.children}\n              </button>\n            ) : null}\n          </div>\n        </div>\n      ))}\n    </div>,\n    document.body,\n  );\n}\n",
      "type": "registry:ui"
    },
    {
      "path": "ui/toast/toast.css",
      "content": "@keyframes vinyaas-toast-in {\n  from {\n    opacity: 0;\n    transform: translateY(6px);\n  }\n  to {\n    opacity: 1;\n    transform: none;\n  }\n}\n\n@keyframes vinyaas-toast-out {\n  from {\n    opacity: 1;\n    transform: none;\n  }\n  to {\n    opacity: 0;\n    transform: translateY(6px);\n  }\n}\n\n.vinyaas-toast-in {\n  animation: vinyaas-toast-in 180ms ease-out;\n}\n\n.vinyaas-toast-out {\n  animation: vinyaas-toast-out 160ms ease-in forwards;\n}\n\n@media (prefers-reduced-motion: reduce) {\n  .vinyaas-toast-in,\n  .vinyaas-toast-out {\n    animation: none;\n  }\n}\n",
      "type": "registry:ui"
    }
  ]
}
