{
  "$schema": "https://vinyaas.vercel.app/schema/registry-item.json",
  "name": "command",
  "type": "registry:ui",
  "dependencies": ["clsx", "tailwind-merge"],
  "files": [
    {
      "path": "ui/command/command.tsx",
      "content": "\"use client\";\n\nimport React, {\n  createContext,\n  useContext,\n  useEffect,\n  useId,\n  useState,\n} from \"react\";\n\nimport { cn } from \"@/lib/utils\";\n\ntype CommandContextValue = {\n  query: string;\n  setQuery: (query: string) => void;\n  listId: string;\n  inputId: string;\n  activeId: string;\n  setActiveId: (id: string) => void;\n};\n\nconst CommandContext = createContext<CommandContextValue | null>(null);\n\nfunction useCommand() {\n  const context = useContext(CommandContext);\n\n  if (!context) {\n    throw new Error(\"Command parts must render inside Command.\");\n  }\n\n  return context;\n}\n\nfunction visibleOptions(list: HTMLElement | null) {\n  return [\n    ...(list?.querySelectorAll<HTMLElement>(\n      '[role=\"option\"]:not([aria-disabled=\"true\"])',\n    ) ?? []),\n  ];\n}\n\nexport type CommandProps = React.ComponentProps<\"div\"> & {\n  onQueryChange?: (query: string) => void;\n};\n\nexport function Command({\n  className,\n  children,\n  onQueryChange,\n  ...props\n}: CommandProps) {\n  const [query, setQueryState] = useState(\"\");\n  const [activeId, setActiveId] = useState(\"\");\n  const listId = useId();\n  const inputId = useId();\n\n  function setQuery(next: string) {\n    setQueryState(next);\n    onQueryChange?.(next);\n  }\n\n  useEffect(() => {\n    const timeout = window.setTimeout(() => {\n      const first = visibleOptions(document.getElementById(listId))[0];\n\n      setActiveId(first?.id ?? \"\");\n    }, 0);\n\n    return () => window.clearTimeout(timeout);\n  }, [query, listId]);\n\n  return (\n    <CommandContext.Provider\n      value={{\n        query,\n        setQuery,\n        listId,\n        inputId,\n        activeId,\n        setActiveId,\n      }}\n    >\n      <div\n        className={cn(\n          \"border-border bg-background text-foreground flex w-full flex-col overflow-hidden rounded-lg border\",\n          className,\n        )}\n        {...props}\n      >\n        {children}\n      </div>\n    </CommandContext.Provider>\n  );\n}\n\nexport type CommandInputProps = React.ComponentProps<\"input\">;\n\nexport function CommandInput({ className, ...props }: CommandInputProps) {\n  const command = useCommand();\n\n  function move(direction: 1 | -1) {\n    const options = visibleOptions(document.getElementById(command.listId));\n    const index = options.findIndex((option) => option.id === command.activeId);\n    const next =\n      options[index + direction] ??\n      options[direction === 1 ? 0 : options.length - 1];\n\n    if (next) {\n      command.setActiveId(next.id);\n    }\n  }\n\n  return (\n    <div className=\"border-border flex items-center gap-2 border-b px-3\">\n      <SearchGlyph />\n      <input\n        {...props}\n        id={command.inputId}\n        role=\"combobox\"\n        aria-expanded=\"true\"\n        aria-controls={command.listId}\n        aria-autocomplete=\"list\"\n        aria-activedescendant={command.activeId || undefined}\n        value={command.query}\n        className={cn(\n          \"placeholder:text-muted-foreground h-11 w-full min-w-0 bg-transparent text-sm outline-none\",\n          className,\n        )}\n        onChange={(event) => {\n          command.setQuery(event.currentTarget.value);\n          props.onChange?.(event);\n        }}\n        onKeyDown={(event) => {\n          if (event.key === \"ArrowDown\") {\n            event.preventDefault();\n            move(1);\n          }\n\n          if (event.key === \"ArrowUp\") {\n            event.preventDefault();\n            move(-1);\n          }\n\n          if (event.key === \"Enter\" && command.activeId) {\n            event.preventDefault();\n            visibleOptions(document.getElementById(command.listId))\n              .find((option) => option.id === command.activeId)\n              ?.click();\n          }\n\n          props.onKeyDown?.(event);\n        }}\n      />\n    </div>\n  );\n}\n\nfunction SearchGlyph() {\n  return (\n    <svg\n      viewBox=\"0 0 24 24\"\n      aria-hidden=\"true\"\n      className=\"text-muted-foreground size-4 shrink-0\"\n      fill=\"none\"\n      stroke=\"currentColor\"\n      strokeWidth=\"2\"\n      strokeLinecap=\"round\"\n      strokeLinejoin=\"round\"\n    >\n      <circle cx=\"11\" cy=\"11\" r=\"7\" />\n      <path d=\"m20 20-3.5-3.5\" />\n    </svg>\n  );\n}\n\nexport type CommandListProps = React.ComponentProps<\"div\">;\n\nexport function CommandList({ className, ...props }: CommandListProps) {\n  const command = useCommand();\n\n  return (\n    <div\n      {...props}\n      id={command.listId}\n      role=\"listbox\"\n      aria-labelledby={command.inputId}\n      className={cn(\n        \"max-h-80 overflow-y-auto overscroll-contain p-1.5\",\n        className,\n      )}\n    />\n  );\n}\n\nexport type CommandEmptyProps = React.ComponentProps<\"p\">;\n\nexport function CommandEmpty({ className, ...props }: CommandEmptyProps) {\n  const command = useCommand();\n  const [empty, setEmpty] = useState(false);\n\n  useEffect(() => {\n    const timeout = window.setTimeout(() => {\n      setEmpty(\n        visibleOptions(document.getElementById(command.listId)).length === 0,\n      );\n    }, 0);\n\n    return () => window.clearTimeout(timeout);\n  }, [command]);\n\n  if (!empty) {\n    return null;\n  }\n\n  return (\n    <p\n      className={cn(\n        \"text-muted-foreground px-3 py-6 text-center text-sm\",\n        className,\n      )}\n      {...props}\n    />\n  );\n}\n\nexport type CommandGroupProps = React.ComponentProps<\"div\"> & {\n  heading: string;\n};\n\nexport function CommandGroup({\n  heading,\n  className,\n  children,\n  ...props\n}: CommandGroupProps) {\n  return (\n    <div\n      role=\"group\"\n      aria-label={heading}\n      className={cn(\n        \"grid gap-0.5 py-1 [:not(:has([role=option]))]:hidden\",\n        className,\n      )}\n      {...props}\n    >\n      <p className=\"text-muted-foreground px-2 pt-2 pb-1 text-xs font-medium\">\n        {heading}\n      </p>\n      {children}\n    </div>\n  );\n}\n\nexport type CommandItemProps = Omit<React.ComponentProps<\"button\">, \"value\"> & {\n  value: string;\n};\n\nexport function CommandItem({\n  value,\n  className,\n  disabled,\n  children,\n  ...props\n}: CommandItemProps) {\n  const command = useCommand();\n  const id = useId();\n  const visible = value\n    .toLowerCase()\n    .includes(command.query.trim().toLowerCase());\n\n  if (!visible) {\n    return null;\n  }\n\n  return (\n    <button\n      {...props}\n      id={id}\n      type=\"button\"\n      role=\"option\"\n      aria-selected={command.activeId === id}\n      aria-disabled={disabled || undefined}\n      disabled={disabled}\n      className={cn(\n        \"hover:bg-accent hover:text-accent-foreground aria-selected:bg-accent aria-selected:text-accent-foreground focus-visible:bg-accent focus-visible:text-accent-foreground flex w-full cursor-pointer items-start gap-2 rounded-md px-2 py-1.5 text-left text-sm outline-none disabled:cursor-not-allowed disabled:opacity-50 [&>svg]:mt-0.5 [&>svg]:shrink-0\",\n        className,\n      )}\n      onMouseEnter={() => {\n        if (!disabled) {\n          command.setActiveId(id);\n        }\n      }}\n    >\n      {children}\n    </button>\n  );\n}\n\nexport type CommandShortcutProps = React.ComponentProps<\"span\">;\n\nexport function CommandShortcut({ className, ...props }: CommandShortcutProps) {\n  return (\n    <span\n      className={cn(\n        \"bg-muted text-muted-foreground mt-0.5 ml-auto shrink-0 rounded px-1.5 py-0.5 font-mono text-[0.6875rem] leading-none\",\n        className,\n      )}\n      {...props}\n    />\n  );\n}\n",
      "type": "registry:ui"
    }
  ]
}
