{
  "$schema": "https://vinyaas.vercel.app/schema/registry-item.json",
  "name": "alert",
  "type": "registry:ui",
  "dependencies": ["clsx", "tailwind-merge"],
  "files": [
    {
      "path": "ui/alert/index.tsx",
      "content": "import React from \"react\";\n\nimport { cn } from \"@/lib/utils\";\n\nconst alertVariants = {\n  default: \"border-border bg-card text-card-foreground\",\n  destructive:\n    \"border-destructive/50 bg-card text-destructive *:data-[slot=alert-description]:text-destructive/90 [&>svg]:text-current\",\n} as const;\n\nexport type AlertVariant = keyof typeof alertVariants;\n\nexport function Alert({\n  className,\n  variant = \"default\",\n  ...props\n}: React.HTMLAttributes<HTMLDivElement> & {\n  variant?: AlertVariant;\n}) {\n  return (\n    <div\n      role=\"alert\"\n      data-slot=\"alert\"\n      data-variant={variant}\n      className={cn(\n        \"relative grid w-full grid-cols-[0_minmax(0,1fr)] items-start gap-y-0.5 rounded-lg border px-4 py-3 text-sm has-[>svg]:grid-cols-[calc(var(--spacing)*4)_minmax(0,1fr)] has-[>svg]:gap-x-3 [&>*:not(svg)]:col-start-2 [&>svg]:col-start-1 [&>svg]:row-span-2 [&>svg]:row-start-1 [&>svg]:mt-0.5 [&>svg]:size-4 [&>svg]:shrink-0 [&>svg]:translate-y-0 [&>svg]:text-current\",\n        alertVariants[variant],\n        className,\n      )}\n      {...props}\n    />\n  );\n}\n\nexport function AlertTitle({\n  className,\n  ...props\n}: React.HTMLAttributes<HTMLDivElement>) {\n  return (\n    <div\n      data-slot=\"alert-title\"\n      className={cn(\n        \"col-start-2 line-clamp-1 min-h-4 font-medium tracking-tight\",\n        className,\n      )}\n      {...props}\n    />\n  );\n}\n\nexport function AlertDescription({\n  className,\n  ...props\n}: React.HTMLAttributes<HTMLDivElement>) {\n  return (\n    <div\n      data-slot=\"alert-description\"\n      className={cn(\n        \"text-muted-foreground col-start-2 grid justify-items-start gap-1 text-sm [&_p]:leading-relaxed\",\n        className,\n      )}\n      {...props}\n    />\n  );\n}\n",
      "type": "registry:ui"
    }
  ]
}
