{
  "$schema": "https://vinyaas.vercel.app/schema/registry-item.json",
  "name": "accordion",
  "type": "registry:ui",
  "dependencies": ["clsx", "tailwind-merge"],
  "files": [
    {
      "path": "ui/accordion/index.tsx",
      "content": "\"use client\";\n\nimport React, { useContext, useEffect, useId, useRef, useState } from \"react\";\n\nimport { cn } from \"@/lib/utils\";\n\ntype AccordionContextValue = {\n  type: \"single\" | \"multiple\";\n  openValues: readonly string[];\n  collapsible: boolean;\n  disabled: boolean;\n  toggle: (value: string) => void;\n};\n\nconst AccordionContext = React.createContext<AccordionContextValue | null>(\n  null,\n);\n\ntype ItemContextValue = {\n  value: string;\n  contentId: string;\n  open: boolean;\n  disabled: boolean;\n};\n\nconst ItemContext = React.createContext<ItemContextValue | null>(null);\n\nfunction useAccordion() {\n  const context = useContext(AccordionContext);\n\n  if (!context) {\n    throw new Error(\"Accordion components must render inside Accordion.\");\n  }\n\n  return context;\n}\n\nfunction useItem() {\n  const context = useContext(ItemContext);\n\n  if (!context) {\n    throw new Error(\"Accordion triggers must render inside AccordionItem.\");\n  }\n\n  return context;\n}\n\nfunction reducedMotion() {\n  return (\n    typeof window !== \"undefined\" &&\n    typeof window.matchMedia === \"function\" &&\n    window.matchMedia(\"(prefers-reduced-motion: reduce)\").matches\n  );\n}\n\ntype AccordionCommon = {\n  className?: string;\n  children: React.ReactNode;\n  collapsible?: boolean;\n  disabled?: boolean;\n};\n\ntype SingleProps = AccordionCommon & {\n  type?: \"single\";\n  value?: string;\n  defaultValue?: string;\n  onValueChange?: (value: string | undefined) => void;\n};\n\ntype MultipleProps = AccordionCommon & {\n  type: \"multiple\";\n  value?: string[];\n  defaultValue?: string[];\n  onValueChange?: (value: string[]) => void;\n};\n\nexport function Accordion(props: SingleProps): React.JSX.Element;\nexport function Accordion(props: MultipleProps): React.JSX.Element;\nexport function Accordion({\n  className,\n  children,\n  collapsible = true,\n  disabled = false,\n  ...props\n}: SingleProps | MultipleProps) {\n  const type = props.type ?? \"single\";\n  const controlled = props.value !== undefined;\n  const initial =\n    props.type === \"multiple\"\n      ? (props.defaultValue ?? [])\n      : props.defaultValue\n        ? [props.defaultValue]\n        : [];\n  const [uncontrolled, setUncontrolled] = useState<string[]>(initial);\n  const openValues =\n    props.type === \"multiple\"\n      ? controlled\n        ? (props.value ?? [])\n        : uncontrolled\n      : controlled\n        ? props.value\n          ? [props.value]\n          : []\n        : uncontrolled;\n  const rootRef = useRef<HTMLDivElement>(null);\n\n  function toggle(item: string) {\n    if (props.type === \"multiple\") {\n      const current = openValues;\n      const next = current.includes(item)\n        ? current.filter((value) => value !== item)\n        : [...current, item];\n\n      if (!controlled) {\n        setUncontrolled(next);\n      }\n\n      props.onValueChange?.(next);\n      return;\n    }\n\n    const current = openValues[0];\n    const next = current === item && collapsible ? undefined : item;\n\n    if (!controlled) {\n      setUncontrolled(next ? [next] : []);\n    }\n\n    props.onValueChange?.(next);\n  }\n\n  function onKeyDown(event: React.KeyboardEvent<HTMLDivElement>) {\n    const key = event.key;\n\n    if (![\"ArrowDown\", \"ArrowUp\", \"Home\", \"End\"].includes(key)) {\n      return;\n    }\n\n    const triggers = [\n      ...(rootRef.current?.querySelectorAll<HTMLButtonElement>(\n        \"[data-accordion-trigger]\",\n      ) ?? []),\n    ].filter((trigger) => !trigger.disabled);\n    const index = triggers.indexOf(document.activeElement as HTMLButtonElement);\n\n    if (index < 0 || triggers.length === 0) {\n      return;\n    }\n\n    event.preventDefault();\n    const next =\n      key === \"Home\"\n        ? 0\n        : key === \"End\"\n          ? triggers.length - 1\n          : key === \"ArrowDown\"\n            ? (index + 1) % triggers.length\n            : (index - 1 + triggers.length) % triggers.length;\n\n    triggers[next]?.focus();\n  }\n\n  return (\n    <AccordionContext.Provider\n      value={{ type, openValues, collapsible, disabled, toggle }}\n    >\n      <div\n        ref={rootRef}\n        data-type={type}\n        className={cn(\n          \"border-border divide-border divide-y border-y\",\n          className,\n        )}\n        onKeyDown={onKeyDown}\n      >\n        {children}\n      </div>\n    </AccordionContext.Provider>\n  );\n}\n\nexport function AccordionItem({\n  value,\n  disabled = false,\n  className,\n  ...props\n}: React.HTMLAttributes<HTMLDivElement> & {\n  value: string;\n  disabled?: boolean;\n}) {\n  const accordion = useAccordion();\n  const contentId = useId();\n  const open = accordion.openValues.includes(value);\n\n  return (\n    <ItemContext.Provider\n      value={{\n        value,\n        contentId,\n        open,\n        disabled: disabled || accordion.disabled,\n      }}\n    >\n      <div\n        data-state={open ? \"open\" : \"closed\"}\n        className={className}\n        {...props}\n      />\n    </ItemContext.Provider>\n  );\n}\n\nexport function AccordionTrigger({\n  className,\n  children,\n  ...props\n}: React.ComponentProps<\"button\">) {\n  const { toggle } = useAccordion();\n  const item = useItem();\n\n  return (\n    <button\n      type=\"button\"\n      data-accordion-trigger=\"\"\n      data-state={item.open ? \"open\" : \"closed\"}\n      aria-expanded={item.open}\n      aria-controls={item.contentId}\n      className={cn(\n        \"flex w-full items-center justify-between gap-3 px-3 py-2 text-left text-sm font-medium focus-visible:outline-none disabled:cursor-not-allowed disabled:opacity-50\",\n        className,\n      )}\n      {...props}\n      disabled={item.disabled || props.disabled}\n      onClick={(event) => {\n        props.onClick?.(event);\n\n        if (event.defaultPrevented || item.disabled || props.disabled) {\n          return;\n        }\n\n        toggle(item.value);\n      }}\n    >\n      {children}\n      <svg\n        viewBox=\"0 0 24 24\"\n        fill=\"none\"\n        aria-hidden=\"true\"\n        className={cn(\n          \"size-4 shrink-0 transition-transform duration-200 ease-out motion-reduce:transition-none\",\n          item.open && \"rotate-180\",\n        )}\n      >\n        <path\n          d=\"m6 9 6 6 6-6\"\n          stroke=\"currentColor\"\n          strokeWidth=\"2\"\n          strokeLinecap=\"round\"\n          strokeLinejoin=\"round\"\n        />\n      </svg>\n    </button>\n  );\n}\n\nexport function AccordionContent({\n  className,\n  children,\n  ...props\n}: React.HTMLAttributes<HTMLDivElement>) {\n  const item = useItem();\n  const [shown, setShown] = useState(item.open);\n\n  useEffect(() => {\n    if (item.open) {\n      const timeout = window.setTimeout(() => setShown(true), 0);\n\n      return () => window.clearTimeout(timeout);\n    }\n\n    const timeout = window.setTimeout(\n      () => setShown(false),\n      reducedMotion() ? 0 : 200,\n    );\n\n    return () => window.clearTimeout(timeout);\n  }, [item.open]);\n\n  return (\n    <div\n      id={item.contentId}\n      data-accordion-panel=\"\"\n      data-state={item.open ? \"open\" : \"closed\"}\n      hidden={!shown && !item.open}\n      className={cn(\n        \"grid overflow-hidden px-3 text-sm transition-[grid-template-rows] duration-200 ease-out motion-reduce:transition-none\",\n        item.open ? \"grid-rows-[1fr]\" : \"grid-rows-[0fr]\",\n        className,\n      )}\n      {...props}\n    >\n      <div className={cn(\"min-h-0 overflow-hidden\", item.open && \"pb-3\")}>\n        {children}\n      </div>\n    </div>\n  );\n}\n",
      "type": "registry:ui"
    }
  ]
}
