{
  "$schema": "https://vinyas.vercel.app/schema/registry-item.json",
  "name": "utils",
  "type": "registry:ui",
  "dependencies": ["clsx", "tailwind-merge"],
  "files": [
    {
      "path": "lib/utils.ts",
      "content": "import { clsx, type ClassValue } from \"clsx\";\nimport { twMerge } from \"tailwind-merge\";\n\nexport function cn(...inputs: ClassValue[]) {\n  return twMerge(clsx(inputs));\n}\n",
      "type": "registry:ui"
    }
  ]
}
