{
  "$schema": "https://vinyaas.vercel.app/schema/registry-item.json",
  "name": "tooltip",
  "type": "registry:ui",
  "dependencies": ["clsx", "tailwind-merge"],
  "files": [
    {
      "path": "ui/tooltip/tooltip.tsx",
      "content": "\"use client\";\n\nimport React, { useId, useLayoutEffect, useRef, useState } from \"react\";\nimport { createPortal } from \"react-dom\";\n\nimport { cn } from \"@/lib/utils\";\n\nexport type TooltipSide = \"top\" | \"right\" | \"bottom\" | \"left\";\n\ntype TriggerProps = React.HTMLAttributes<HTMLElement> & {\n  ref?: React.Ref<HTMLElement>;\n};\n\nfunction arrowStyle(side: TooltipSide, arrow = 12): React.CSSProperties {\n  const size = 6;\n\n  if (side === \"top\" || side === \"bottom\") {\n    return {\n      left: arrow,\n      borderLeftWidth: size,\n      borderRightWidth: size,\n      borderTopWidth: side === \"top\" ? size : 0,\n      borderBottomWidth: side === \"bottom\" ? size : 0,\n    };\n  }\n\n  return {\n    top: arrow,\n    borderTopWidth: size,\n    borderBottomWidth: size,\n    borderLeftWidth: side === \"left\" ? size : 0,\n    borderRightWidth: side === \"right\" ? size : 0,\n  };\n}\n\nexport function Tooltip({\n  children,\n  content,\n  side = \"top\",\n  delayDuration = 400,\n  className,\n}: {\n  children: React.ReactElement<TriggerProps>;\n  content: React.ReactNode;\n  side?: TooltipSide;\n  delayDuration?: number;\n  className?: string;\n}) {\n  const id = useId();\n  const [open, setOpen] = useState(false);\n  const [point, setPoint] = useState<{\n    top: number;\n    left: number;\n    side: TooltipSide;\n    arrow: number;\n  } | null>(null);\n  const rootRef = useRef<HTMLSpanElement>(null);\n  const tipRef = useRef<HTMLSpanElement>(null);\n  const timer = useRef<ReturnType<typeof setTimeout> | null>(null);\n\n  function clearTimer() {\n    if (timer.current) {\n      clearTimeout(timer.current);\n      timer.current = null;\n    }\n  }\n\n  function show(immediate: boolean) {\n    clearTimer();\n\n    if (immediate || delayDuration <= 0) {\n      setOpen(true);\n      return;\n    }\n\n    timer.current = setTimeout(() => setOpen(true), delayDuration);\n  }\n\n  function hide(nextFocus: EventTarget | null) {\n    clearTimer();\n\n    if (nextFocus instanceof Node && rootRef.current?.contains(nextFocus)) {\n      return;\n    }\n\n    setOpen(false);\n  }\n\n  useLayoutEffect(() => {\n    if (!open) {\n      return;\n    }\n\n    const arrowSize = 6;\n\n    function place() {\n      const triggerNode = rootRef.current;\n      const tipNode = tipRef.current;\n\n      if (!triggerNode || !tipNode) {\n        return;\n      }\n\n      const trigger = triggerNode.getBoundingClientRect();\n      const tip = tipNode.getBoundingClientRect();\n      const gap = arrowSize;\n      let nextSide = side;\n\n      if (\n        side === \"top\" &&\n        trigger.top - tip.height - gap < 8 &&\n        window.innerHeight - trigger.bottom > trigger.top\n      ) {\n        nextSide = \"bottom\";\n      } else if (\n        side === \"bottom\" &&\n        trigger.bottom + tip.height + gap > window.innerHeight - 8 &&\n        trigger.top > window.innerHeight - trigger.bottom\n      ) {\n        nextSide = \"top\";\n      } else if (\n        side === \"left\" &&\n        trigger.left - tip.width - gap < 8 &&\n        window.innerWidth - trigger.right > trigger.left\n      ) {\n        nextSide = \"right\";\n      } else if (\n        side === \"right\" &&\n        trigger.right + tip.width + gap > window.innerWidth - 8 &&\n        trigger.left > window.innerWidth - trigger.right\n      ) {\n        nextSide = \"left\";\n      }\n\n      let top = trigger.top - tip.height - gap;\n      let left = trigger.left + trigger.width / 2 - tip.width / 2;\n\n      if (nextSide === \"bottom\") {\n        top = trigger.bottom + gap;\n      }\n\n      if (nextSide === \"left\") {\n        top = trigger.top + trigger.height / 2 - tip.height / 2;\n        left = trigger.left - tip.width - gap;\n      }\n\n      if (nextSide === \"right\") {\n        top = trigger.top + trigger.height / 2 - tip.height / 2;\n        left = trigger.right + gap;\n      }\n\n      left = Math.min(Math.max(8, left), window.innerWidth - tip.width - 8);\n      top = Math.min(Math.max(8, top), window.innerHeight - tip.height - 8);\n\n      const along =\n        nextSide === \"left\" || nextSide === \"right\"\n          ? trigger.top + trigger.height / 2 - top\n          : trigger.left + trigger.width / 2 - left;\n      const limit =\n        nextSide === \"left\" || nextSide === \"right\" ? tip.height : tip.width;\n      const arrow = Math.min(Math.max(12, along), Math.max(12, limit - 12));\n\n      setPoint({ top, left, side: nextSide, arrow });\n    }\n\n    place();\n    const scrollers: EventTarget[] = [window];\n    let parent = rootRef.current?.parentElement ?? null;\n\n    while (parent) {\n      const style = getComputedStyle(parent);\n      const overflow = `${style.overflow}${style.overflowX}${style.overflowY}`;\n\n      if (/(auto|scroll)/.test(overflow)) {\n        scrollers.push(parent);\n      }\n\n      parent = parent.parentElement;\n    }\n\n    for (const scroller of scrollers) {\n      scroller.addEventListener(\"scroll\", place);\n    }\n\n    window.addEventListener(\"resize\", place);\n\n    return () => {\n      for (const scroller of scrollers) {\n        scroller.removeEventListener(\"scroll\", place);\n      }\n\n      window.removeEventListener(\"resize\", place);\n    };\n  }, [open, side, content]);\n\n  const child = React.cloneElement(children, {\n    \"aria-describedby\": open ? id : undefined,\n    onKeyDown: (event: React.KeyboardEvent<HTMLElement>) => {\n      children.props.onKeyDown?.(event);\n\n      if (event.key === \"Escape\") {\n        setOpen(false);\n      }\n    },\n  });\n\n  return (\n    <span\n      ref={rootRef}\n      className=\"inline-flex\"\n      onMouseEnter={() => show(false)}\n      onMouseLeave={() => {\n        if (rootRef.current?.contains(document.activeElement)) {\n          return;\n        }\n\n        hide(null);\n      }}\n      onFocus={() => show(true)}\n      onBlur={(event) => hide(event.relatedTarget)}\n    >\n      {child}\n      {open\n        ? createPortal(\n            <span\n              ref={tipRef}\n              id={id}\n              role=\"tooltip\"\n              data-side={point?.side ?? side}\n              style={{\n                position: \"fixed\",\n                top: point?.top ?? -9999,\n                left: point?.left ?? -9999,\n              }}\n              className={cn(\n                \"bg-foreground text-background vinyaas-tooltip-in pointer-events-none z-50 max-w-xs rounded-md px-2 py-1 text-sm\",\n                className,\n              )}\n            >\n              {content}\n              <span\n                data-tooltip-arrow=\"\"\n                aria-hidden=\"true\"\n                className={cn(\n                  \"pointer-events-none absolute border-solid\",\n                  (point?.side ?? side) === \"top\" &&\n                    \"border-t-foreground bottom-0 -translate-x-1/2 translate-y-full border-b-0 border-x-transparent\",\n                  (point?.side ?? side) === \"bottom\" &&\n                    \"border-b-foreground top-0 -translate-x-1/2 -translate-y-full border-t-0 border-x-transparent\",\n                  (point?.side ?? side) === \"left\" &&\n                    \"border-l-foreground right-0 translate-x-full -translate-y-1/2 border-r-0 border-y-transparent\",\n                  (point?.side ?? side) === \"right\" &&\n                    \"border-r-foreground left-0 -translate-x-full -translate-y-1/2 border-l-0 border-y-transparent\",\n                )}\n                style={arrowStyle(point?.side ?? side, point?.arrow)}\n              />\n            </span>,\n            document.body,\n          )\n        : null}\n    </span>\n  );\n}\n",
      "type": "registry:ui"
    }
  ]
}
