{
  "$schema": "https://vinyaas.vercel.app/schema/registry-item.json",
  "name": "typography",
  "type": "registry:ui",
  "dependencies": ["clsx", "tailwind-merge"],
  "files": [
    {
      "path": "ui/typography/index.tsx",
      "content": "import React from \"react\";\n\nimport { cn } from \"@/lib/utils\";\n\nexport type TypographyProps = React.ComponentProps<\"div\">;\n\nexport function Typography({ className, ref, ...props }: TypographyProps) {\n  return (\n    <div\n      ref={ref}\n      className={cn(\"text-foreground flex flex-col gap-4\", className)}\n      {...props}\n    />\n  );\n}\n\nexport function TypographyH1({\n  className,\n  ref,\n  ...props\n}: React.ComponentProps<\"h1\">) {\n  return (\n    <h1\n      ref={ref}\n      className={cn(\n        \"text-foreground text-3xl font-semibold tracking-tight text-balance\",\n        className,\n      )}\n      {...props}\n    />\n  );\n}\n\nexport function TypographyH2({\n  className,\n  ref,\n  ...props\n}: React.ComponentProps<\"h2\">) {\n  return (\n    <h2\n      ref={ref}\n      className={cn(\n        \"text-foreground text-2xl font-semibold tracking-tight text-balance\",\n        className,\n      )}\n      {...props}\n    />\n  );\n}\n\nexport function TypographyH3({\n  className,\n  ref,\n  ...props\n}: React.ComponentProps<\"h3\">) {\n  return (\n    <h3\n      ref={ref}\n      className={cn(\n        \"text-foreground text-xl font-semibold tracking-tight text-balance\",\n        className,\n      )}\n      {...props}\n    />\n  );\n}\n\nexport function TypographyH4({\n  className,\n  ref,\n  ...props\n}: React.ComponentProps<\"h4\">) {\n  return (\n    <h4\n      ref={ref}\n      className={cn(\n        \"text-foreground text-lg font-medium tracking-tight\",\n        className,\n      )}\n      {...props}\n    />\n  );\n}\n\nexport function TypographyP({\n  className,\n  ref,\n  ...props\n}: React.ComponentProps<\"p\">) {\n  return (\n    <p\n      ref={ref}\n      className={cn(\"text-body text-base leading-7\", className)}\n      {...props}\n    />\n  );\n}\n\nexport function TypographyLead({\n  className,\n  ref,\n  ...props\n}: React.ComponentProps<\"p\">) {\n  return (\n    <p\n      ref={ref}\n      className={cn(\"text-body text-lg leading-8\", className)}\n      {...props}\n    />\n  );\n}\n\nexport function TypographyLarge({\n  className,\n  ref,\n  ...props\n}: React.ComponentProps<\"p\">) {\n  return (\n    <p\n      ref={ref}\n      className={cn(\"text-foreground text-lg leading-7 font-medium\", className)}\n      {...props}\n    />\n  );\n}\n\nexport function TypographySmall({\n  className,\n  ref,\n  ...props\n}: React.ComponentProps<\"small\">) {\n  return (\n    <small\n      ref={ref}\n      className={cn(\"text-foreground text-sm leading-5\", className)}\n      {...props}\n    />\n  );\n}\n\nexport function TypographyMuted({\n  className,\n  ref,\n  ...props\n}: React.ComponentProps<\"p\">) {\n  return (\n    <p\n      ref={ref}\n      className={cn(\"text-muted-foreground text-sm leading-5\", className)}\n      {...props}\n    />\n  );\n}\n\nexport function TypographyBlockquote({\n  className,\n  ref,\n  ...props\n}: React.ComponentProps<\"blockquote\">) {\n  return (\n    <blockquote\n      ref={ref}\n      className={cn(\n        \"border-border text-body border-l-2 pl-4 leading-7 italic\",\n        className,\n      )}\n      {...props}\n    />\n  );\n}\n\nexport function TypographyList({\n  className,\n  ref,\n  ...props\n}: React.ComponentProps<\"ul\">) {\n  return (\n    <ul\n      ref={ref}\n      className={cn(\n        \"text-body list-disc pl-5 text-base leading-7 [&>li]:mt-2\",\n        className,\n      )}\n      {...props}\n    />\n  );\n}\n",
      "type": "registry:ui"
    }
  ]
}
